{
	"security": {
		"riskLevels": {
                        "allowed": ["low", "medium", "high"],
			"requireApproval": ["high"]
		},
		"signatures": {
			"required": true,
			"trustedPublishers": ["ModelContextProtocol", "Anthropic", "GitHub"],
			"sigstoreValidation": true
		},
		"permissions": {
			"dangerous": [
				"system:exec",
				"system:admin",
				"files:write:root",
				"network:raw"
			],
			"requireConfirmation": ["files:write", "system:exec", "network:external"]
		}
	},
	"marketplace": {
		"registries": {
			"official": "https://registry.cortex-os.dev/v1/registry.json",
			"community": "https://community.mcp.dev/v1/registry.json",
			"allowCustom": false
		},
		"caching": {
			"ttl": 300000,
			"maxSize": 104857600
		},
		"validation": {
			"strictMode": true,
			"allowPrerelease": false,
			"minRating": 3.0
		}
	},
	"installation": {
		"sandboxed": true,
		"isolatedEnvironments": true,
		"resourceLimits": {
			"memory": "512MB",
			"cpu": "0.5",
			"diskSpace": "1GB"
		},
		"networkAccess": {
			"allowed": ["https://api.github.com", "https://registry.npmjs.org"],
			"blocked": ["file://", "ftp://"]
		}
	},
	"audit": {
		"logging": {
			"level": "info",
			"destinations": ["file", "syslog"]
		},
		"monitoring": {
			"healthChecks": true,
			"performanceMetrics": true,
			"securityEvents": true
		}
	}
}
